hash,message,parent_hashes,is_merge,modified_files
9fdc8d6fd23153fc6dfd9172e665e7a8d4f5358c,"Migrate tensorflow_graphics/util to using TensorFlow 2.  - tf.compat.v1.name_scope            -> tf.name_scope - tf.compat.v1.where                 -> tf.where - tf.compat.v1.dimension_value       -> tf.compat.dimension_value - tf.compat.v1.assert_*              -> tf.debugging.assert_* - tf.compat.v1.div                   -> tf.math.floordiv - tf.compat.v2.test.compute_gradient -> tf.test.compute_gradient  Don't replace:  - tf.compat.v1.Dimension, tf.compat.v1.test.compute_gradient, tf.compat.v1.set_random_seed, and tf.compat.v1.lite.TFLiteConverter.from_session as they don't have TensorFlow 2 equivalents  - tf.compat.v1.Session, tf.compat.v1.global_variables_initializer, compat.v1.placeholder, tf.compat.v1.placeholder_with_default, and tf.compat.v1.sparse.placeholder as they are required to run tests in graph mode  PiperOrigin-RevId: 369156735",480100e2e5226eb394d0654c00952d4eb81e809a,False,euler_test.py;asserts.py;safe_ops.py;shape.py;test_case.py;asserts_test.py
ee853d4fbd63352ad091c1bb69d4702ccd71a61a,Fix a typo bug in _compute_gradient_error.  Also replace deprecated function assertRaisesRegexp with assertRaisesRegex: https://docs.python.org/3/library/unittest.html#unittest.TestCase.assertRaisesRegex  PiperOrigin-RevId: 369278747,5b014eb8b91c39d735b6986b0cb11f4d5c2b175f,False,test_case.py
c0f165624783d7f7256d5d7931de7662f878d8b2,Fix a bug in trimesh_feature where the face lists of multiple meshes in a scene were merged by numpy into a 3D array when they all had the same dimensions (instead of keeping them as a 1D object array of 2D arrays).  PiperOrigin-RevId: 376988833,d4f5ba15e426c6f57720f3285e175ba33698300a,False,trimesh_feature.py
e7e624af3efbb52db67a262d03dde7eccc97eda9,Fix the random patch sampling indexing.  PiperOrigin-RevId: 377874187,c0f165624783d7f7256d5d7931de7662f878d8b2,False,perspective.py
1d33eb6beada7b6e7b1a162034478d79c90e3ba8,Small corrections for docstrings.  PiperOrigin-RevId: 379694803,ca88c65ef8051384e307c9ade4bc01d64a981728,False,rasterization_backend.py;triangle_rasterizer.py
cbde26be104e3588b14f91e24d496d46c275d315,"Fix missing tensorflow_graphics documentation.  Several modules were missing documentation due to missing imports in the __init__.py files. I added the ones I could see that were missing. I'm not sure if there is a systematic way to do this, as it seems we don't want to add every function to the API documentation. I omitted the rendering kernels and internal utility functions from the doc imports, for example.  PiperOrigin-RevId: 389260704",0729425f4906ceac6f4327552e91d954da0bd351,False,tfg-main-pypi.yml;tfg-test-pypi.yml;__init__.py;build_docs.py;__init__.py;rasterization_backend.py;__init__.py;__init__.py
0807291bd437693173df9238893ba3e463c95c50,"Trying to fix the inverse rendering colab.  Adding a trailing comma to the ""provenance=[]"" field in cl/389701407 to satisfy the presubmit also broke the JSON, because JSON doesn't allow trailing commas in the last item of a list. In this CL I moved provenance up in the list to avoid the trailing comma issue.  PiperOrigin-RevId: 392659258",3c0b664d04af574225c5aeaea41478a43493aaff,False,inverse_rendering.ipynb
0dbe2461c5b6a109a4aa4f2277f5ed280e1514f5,Silence some pytype errors.  PiperOrigin-RevId: 398607556,907171ad32edf79b570569c44e1e6384d04345ad,False,architectures_style_gan_v2.py
6cde0ce2c5123384ba71d0463736ded096ad4be1,Fixes a pytype issue.  PiperOrigin-RevId: 399305352,0dbe2461c5b6a109a4aa4f2277f5ed280e1514f5,False,architectures_style_gan_v2.py
6c537488fae360e350f90ca35d58c9e9a6e34dc4,Fix typo.  PiperOrigin-RevId: 403380539,6cde0ce2c5123384ba71d0463736ded096ad4be1,False,utils.py
ffe56e072dbcf4fcf55d94dd536b09dc11f7b09f,Changes -std=c++11 to -std=c++14 in rendering/kernels/BUILD.oss and rendering/opengl/BUILD.oss to avoid github build errors.  PiperOrigin-RevId: 409494160,59fe9caec32743672731af62f94bb2aea94e4951,False,BUILD;BUILD
aeeb6e4753b8561ecfd39234ceea1436cd65e89e,"Corrects the documentation for dual_quaternion.to_rotation_translation and makes dual_quaternion.from_rotation_translation compatible, i.e. it accepts a quaternion instead of a rotation matrix.  PiperOrigin-RevId: 410062876",f643ebe5ad4c2199511994824640f227cd92de0d,False,dual_quaternion.py;dual_quaternion_test.py
a15064cc9f9626327e3992d20b64d83668452692,Corrects an error in dual_quaternion.point_to_dual_quaternion.  PiperOrigin-RevId: 413980512,beba9e63c2c43624509bce2c1b92ed1453527c08,False,dual_quaternion.py;dual_quaternion_test.py
7075bf26289336fd91995efbc2e7346afb20d7ae,Fixes improper serialization code route for functional models.  PiperOrigin-RevId: 524097977,ac4fc8377c4ed78d10695c1a2b4cd68f8fdd5430,False,architectures_style_gan_test.py;architectures_style_gan_v2_test.py
c7bd1bf35afb9f20c73404773d3ad9c989f947b0,Silence some pytype errors.  PiperOrigin-RevId: 527620315,7075bf26289336fd91995efbc2e7346afb20d7ae,False,shapenet.py
320e78201040356cb55e43c22bbe26d6e4302330,[numpy] Fix users of NumPy APIs that are removed in NumPy 2.0.  This change migrates users of APIs removed in NumPy 2.0 to their recommended replacements (https://numpy.org/devdocs/numpy_2_0_migration_guide.html).  PiperOrigin-RevId: 655956468,77773cb50eb499cc6b0fbc2d9de7cafb4794b67d,False,asserts_test.py
8f60a9305ce3bd8ee271b3128b01326f20c5ad26,"[numpy] Fix users of NumPy APIs that are removed in NumPy 2.0.  This change migrates users of APIs removed in NumPy 2.0 to their recommended replacements (https://numpy.org/doc/stable/numpy_2_0_migration_guide.html).  This change replaces uses of `np.math`, which is a deprecated alias for the builtin `math` module, with the builtin `math` module. `np.math` is removed in NumPy 2.0.  PiperOrigin-RevId: 658227973",320e78201040356cb55e43c22bbe26d6e4302330,False,math_test.py;rasterizer_op_test.py;rasterization_test_utils.py
